<?xml version="1.0" encoding="UTF-8"?>
<telemetry xmlns="http://www.telemetry.org"
           xmlns:xsdi="http://www.w3.org/2001/XMLSchema-instance"
           xsdi:schemaLocation="http://www.telemetry.org telemetry.xsd">
	<cars>
		<car>
			<idCar>1</idCar>
			<name>VW</name>
			<typ>Golf</typ>
			<telemetryDataList>
				<telemetryData>
					<idTelemetryData>1</idTelemetryData>
					<latitude>0</latitude>
					<longitude>1</longitude>
					<speed>100</speed>
					<capacity>30</capacity>
				</telemetryData>
				<telemetryData>
					<idTelemetryData>2</idTelemetryData>
					<latitude>0</latitude>
					<longitude>1</longitude>
					<speed>130</speed>
					<capacity>23</capacity>
				</telemetryData>
			</telemetryDataList>
		</car>
		<car>
			<idCar>2</idCar>
			<name>VW</name>
			<typ>Polo</typ>
			<telemetryDataList>
				<telemetryData>
					<idTelemetryData>1</idTelemetryData>
					<latitude>0</latitude>
					<longitude>1</longitude>
					<speed>100</speed>
					<capacity>30</capacity>
				</telemetryData>
				<telemetryData>
					<idTelemetryData>2</idTelemetryData>
					<latitude>0</latitude>
					<longitude>1</longitude>
					<speed>90</speed>
					<capacity>32</capacity>
				</telemetryData>
			</telemetryDataList>
		</car>
	</cars>			
</telemetry>